{
  "$schema": "https://json-schema.org/draft/2020-12/schema",
  "$id": "https://example.local/schemas/workflow.schema.json",
  "title": "WorkflowSpec",
  "type": "object",
  "additionalProperties": false,
  "required": ["id", "version", "steps"],
  "properties": {
    "id": { "type": "string", "minLength": 1 },
    "version": { "type": "string", "minLength": 1 },
    "name": { "type": "string" },
    "description": { "type": "string" },
    "steps": {
      "type": "array",
      "minItems": 1,
      "items": { "$ref": "#/$defs/step" }
    },
    "edges": {
      "type": "array",
      "items": { "$ref": "#/$defs/edge" }
    },
    "gates": {
      "type": "array",
      "items": { "$ref": "#/$defs/gate" }
    },
    "policies": {
      "type": "object",
      "additionalProperties": true
    },
    "artifacts": {
      "type": "array",
      "items": { "$ref": "#/$defs/artifact" }
    }
  },
  "$defs": {
    "edge": {
      "type": "object",
      "additionalProperties": false,
      "required": ["from", "to"],
      "properties": {
        "from": { "type": "string", "minLength": 1 },
        "to": { "type": "string", "minLength": 1 },
        "when": { "type": "string" }
      }
    },
    "gate": {
      "type": "object",
      "additionalProperties": false,
      "required": ["id", "type"],
      "properties": {
        "id": { "type": "string", "minLength": 1 },
        "type": { "type": "string", "minLength": 1 },
        "title": { "type": "string" },
        "required": { "type": "boolean", "default": true },
        "params": {
          "type": "object",
          "additionalProperties": true
        }
      }
    },
    "artifact": {
      "type": "object",
      "additionalProperties": false,
      "required": ["id", "path"],
      "properties": {
        "id": { "type": "string", "minLength": 1 },
        "path": { "type": "string", "minLength": 1 },
        "mimeType": { "type": "string" },
        "producerStepId": { "type": "string" }
      }
    },
    "step": {
      "type": "object",
      "additionalProperties": false,
      "required": ["id", "type", "title"],
      "properties": {
        "id": { "type": "string", "minLength": 1 },
        "type": { "type": "string", "minLength": 1 },
        "title": { "type": "string", "minLength": 1 },
        "description": { "type": "string" },
        "owner": { "type": "string" },
        "inputs": {
          "type": "object",
          "additionalProperties": true
        },
        "outputs": {
          "type": "object",
          "additionalProperties": true
        },
        "gates": {
          "type": "array",
          "items": { "type": "string" }
        },
        "toolHints": {
          "type": "object",
          "additionalProperties": true
        }
      }
    }
  }
}

